#1 Ether / IP / TCP 192.168.0.2:65033 > 93.184.216.34:http S
#2 Ether / IP / TCP 192.168.0.2:64922 > 93.184.216.34:http PA / Raw / Data : b'GET / HTTP/1.1\r\nHost: www.example.com\r\nConnection: keep-alive\r\nCache-Control: max-age=0\r\nUpgrade-Insecure-Requests: 1\r\nUser-Agent: Mozilla/5.0 (Windows NT 10.0; Win64; x64) AppleWebKit/537.36 (KHTML, like Gecko) Chrome/76.0.3809.100 Safari/537.36\r\nAccept: text/html,application/xhtml+xml,application/xml;q=0.9,image/webp,image/apng,*/*;q=0.8,application/signed-exchange;v=b3\r\nAccept-Encoding: gzip, deflate\r\nAccept-Language: ko-KR,ko;q=0.9,ja-JP;q=0.8,ja;q=0.7,en-US;q=0.6,en;q=0.5\r\nIf-None-Match: "1541025663"\r\nIf-Modified-Since: Fri, 09 Aug 2013 23:54:35 GMT\r\n\r\n'
#3 Ether / IP / TCP 93.184.216.34:http > 192.168.0.2:65033 SA
#4 Ether / IP / TCP 192.168.0.2:65033 > 93.184.216.34:http A
#5 Ether / IP / TCP 93.184.216.34:http > 192.168.0.2:64922 A
#6 Ether / IP / TCP 93.184.216.34:http > 192.168.0.2:64922 PA / Raw / Data : b'HTTP/1.1 304 Not Modified\r\nAccept-Ranges: bytes\r\nCache-Control: max-age=604800\r\nDate: Wed, 21 Aug 2019 08:09:47 GMT\r\nEtag: "1541025663"\r\nExpires: Wed, 28 Aug 2019 08:09:47 GMT\r\nLast-Modified: Fri, 09 Aug 2013 23:54:35 GMT\r\nServer: ECS (sec/9795)\r\nVary: Accept-Encoding\r\nX-Cache: HIT\r\n\r\n'
#7 Ether / IP / TCP 192.168.0.2:64922 > 93.184.216.34:http A
#8 Ether / IP / TCP 192.168.0.2:64922 > 93.184.216.34:http PA / Raw / Data : b'GET / HTTP/1.1\r\nHost: www.example.com\r\nConnection: keep-alive\r\nCache-Control: max-age=0\r\nUpgrade-Insecure-Requests: 1\r\nUser-Agent: Mozilla/5.0 (Windows NT 10.0; Win64; x64) AppleWebKit/537.36 (KHTML, like Gecko) Chrome/76.0.3809.100 Safari/537.36\r\nAccept: text/html,application/xhtml+xml,application/xml;q=0.9,image/webp,image/apng,*/*;q=0.8,application/signed-exchange;v=b3\r\nAccept-Encoding: gzip, deflate\r\nAccept-Language: ko-KR,ko;q=0.9,ja-JP;q=0.8,ja;q=0.7,en-US;q=0.6,en;q=0.5\r\nIf-None-Match: "1541025663"\r\nIf-Modified-Since: Fri, 09 Aug 2013 23:54:35 GMT\r\n\r\n'
#9 Ether / IP / TCP 93.184.216.34:http > 192.168.0.2:64922 PA / Raw / Data : b'HTTP/1.1 304 Not Modified\r\nAccept-Ranges: bytes\r\nCache-Control: max-age=604800\r\nDate: Wed, 21 Aug 2019 08:09:52 GMT\r\nEtag: "1541025663"\r\nExpires: Wed, 28 Aug 2019 08:09:52 GMT\r\nLast-Modified: Fri, 09 Aug 2013 23:54:35 GMT\r\nServer: ECS (sec/9795)\r\nVary: Accept-Encoding\r\nX-Cache: HIT\r\n\r\n'
#10 Ether / IP / TCP 192.168.0.2:64922 > 93.184.216.34:http A
#1 Ether / IP / TCP 192.168.0.2:65038 > 104.74.157.168:https RA
#2 Ether / IP / TCP 192.168.0.2:65039 > 104.74.157.168:https RA
#3 Ether / IP / TCP 192.168.0.2:65033 > 93.184.216.34:http A / Raw / Data : b'\x00'
#4 Ether / IP / TCP 93.184.216.34:http > 192.168.0.2:65033 A
#5 Ether / IP / TCP 192.168.0.2:65008 > 216.58.197.195:https A / Raw / Data : b'\x00'
#6 Ether / IP / TCP 216.58.197.195:https > 192.168.0.2:65008 A
#7 Ether / IP / TCP 192.168.0.2:65024 > 162.125.80.3:https PA / Raw / Data : b'\x17\x03\x03\x02Ox\xc2v\xa51Tq\x0b8\\W\x9a\x02V\xa3\x97\xfe\x87\x84W:\x98\xc5\x12\xc7g\x9a5\xcb\xf5e\x13b\xf2\x1fp\x97\x1d\x1f\x02u5\xedm&6 \xc1\x94N\x1dT\xeb\x0e\x85\xb7\xb3I<\xcb\x8e\xb7\xec\x86\x16\xd2\x9a\xfd\x89\x16M3\xc2v\xac\x1fF\x0bv\xcfa\x9fk\xb5\x1a\x89\xcc\xaate\x97\xc7\xb1\xa4\xe5\xbc+ga3\x9a\x0f\x98F\xa5u\xbe\x9f\x90\xdd\x05\xc5\xb8\x85+X\xfc\xc3}\x8d\xd2\x8c\x15\xde\xe5\xe8R8\x96\xcf\xe1\x970\x9e\xc8\xa0l\x14?T\xdd^\x86,\xe6\xa8\x19\x18\xc3\xa8\xf9@\xc0~\xc4>\x05\xfb; \xaf\x12\x80O\xc3^\xaa\xda\x8f\x95!Fs0\xd0Z\xd1s\xf6\xbd(\x0f-E\x95o\xb8\x11a;\xbd\x10{@\xa2\x98B\xc3\xb0\xe6J\xab\x8cm\\\xfd\xa1\xb1\xaeA\xc6\xb0{$|\t\xceQ\xa9\xbd\x88*Pj\xac\x92\xfc\xd1\xb5\x94L\xfc\xa0\x93|\xff=\x9e\x98\xcc\xf1\x04E\x01\xc2\x99#=G9\xb6\xa8\x10\xf0\xdbm\x90E\x1c\xb5\xc3\xed\x0b\x0b%\xf69H\xa1(8\x97LP\xf8\x1d6\xf2\\\x9c\xa0\x00\x8dL\xf4;\xa1\xa5\xdb\x0b;QUR<\xb9\xd9?\xe4\xd3a\xc3\xfd\x81\xb8\x1a9\xf8\x1c\xc7\xf4\xc30?\\6#&\x8b\xdf\xda\xdb\xb6\x0c\xe3\x8bB\xf0\x9f;\xae\x06\x83hl\x8f\xb7\x17Jc5P)H\xfb\x0f\xf3\xbf[\x94\xeb\x87g\x13\x81\nC\x1a1}.\x00\xadul\xfd\xfbr\xdc\xf7\x9a;Oi\x8e\xa6j\x13~\xd0\xf1\x00\x80\xeak__\xff\x81u\xf2\xea^$2\x9a\xcd\xf9!\'q\x15\xca\xd3m\xd93\xdcF\xe3\xd5\xc8iX.\x9c\x8f\x0f\x94\xcd\xaa\x9f\xc2\x13\x8a\xee$\xd3&\xaeN\xc0pT\x9a.\x9b\xa5\xbc\x83\xafL\x13\x80<\xc0\xa4X\xc7\xcd/=\x92\x04\x8bS\x1et\xc7\xb0>\xd1\xebn\x94\xbctc\xf33\xa1\xfa\xde\x02\xe7=\x04\xcc\xcf\xcat/2\x94\xf6\xb0\xe52/\x19\xc7\x85_\xfe\xe8\xeeS\x89,Ll\x1e\xb3\x84N]\x0bL\xb1\x0f\x82\x10\xfcq0MH\xe2\xf80\'J\xbfW\xf7vk\x91\x0f5\xb4K\x0e\x18?L\xaa\x0b\xae\xdfI$\xae\x92\xb2h\x95\x00O8\x8fht<\xdd\xd0\xe0\xb8q\x14Y}V"\x19\xaf\x03\xd4fU\xc5\xcfQS\xd3\x99\xba\xec\x90\xbb\xf2\xa3\xa0\xc3BM\xa4#V+\x87'
#8 Ether / IP / TCP 192.168.0.2:65040 > 111.221.29.254:https S
#9 Ether / IP / TCP 162.125.80.3:https > 192.168.0.2:65024 A
#10 Ether / IP / TCP 192.168.0.2:65024 > 162.125.80.3:https PA / Raw / Data : b'\x17\x03\x03\x02\xf3x\xc2v\xa51Tq\x0c\xd0\xcf\x9as\xd84\xb2\x8b>\xb4;\xa3\xda\xadS\xc5\x18\x04\xbc\x13\x93\x05\xdbd\x12\xc5\xa7Qu\xa3i7\x9f\xd2\x8b\xc1D\xdc\x89|\xb7\xeb\xe8\x18d\xc2&\xf1\xc3\xadx\x86\xfe\x04\xb2\xa1\xf1L\xcc\xbcI\x8f\xf8\xa7\xcf\x89$\xd3\xe60\xb2G\x8b\xc2\x14\x7f\x00\x92\x81g\xc0?J\xce0\x8e\xf8\xd6G\xc5\x98\x06\t\xeb\xb9\x8aI-Q\xdffD/\xfbY\x03\x061\xec\xf8\xab\xdf\xb4\x86K\x10\xf3\xf3^\xd7b\xe0U\x87\xf8\xe7Q\x8d\xd8\xaf%\xc8~<x\xd7m\xae(\x83\xea\xae\xf0\xa6\xf5 \xc7\x07\xac\x02\xfc">Ld\x17\xb0q\xee\xfc\xc67\x89p\xb6\x08\x92\x80\x7f\xef\r\xf6\r\xe6\x8a\xab\x90=E\x1c!\x1e\x87\x93s|\xc2\x11\xf33V\xd4\xd4\xf3\xc2\x15\xcd\xea@5\xd8\x17\xaf-R\xc8<\x18\xef\xe7\xf3\xf1\xfd\xbd\xa6O>Be\xb3\\\x12\x89\x83\xc1\xc0\xf3P\xe0HZ*\xd2\xb8l\x1a\xd2u\xa1(+pq\xcd\x0c\x07\x00>\xab\xfd2R\xad\xe1Z\xa0\xa7\x1c\x93\xd8r\x86VN:\xbe\x82\xc3\x8f\xda\\\x01$J0\x83"\x04\x14\x8b\xeeD\x82\xa0\xd1\xfc\x80\x87\xa4j\x89\x91\xe0<d\xeck\x0b5~\xd4<\xcc\xabW\xbe\xed\x1e,#\xc8&`\x1b\xce\x16\xab\xb1\xee\xaa\x16L\xd8\xb7\x8bT1-\x00\x90\xfa"<+\xbbq\x9b\xcc\xafH\xa4\xa42\xd3\x9e\x01\xec\x04\xbcsb\xddw\x07X\xf2X{\r\x93\xe3c\xbea\x8d\x98\xe5\x1581\xb8\xe0`9\x1aScM\x06\x9e\x07)\xeeg\x8a\xfa\x7fB\xc8\x04\xc2\xff\xce,?)$\x17\r\n\xd0\x11\xc7\xf4\xec\x95\xbe\xbe\x137\x0c\xac\x06n\xa0\x8a\xb7]Ya\x03\xfa\xa1\xa7\xae6\x82\x16\xe5\x82>\xa7\x8f\xbdO\xdb\xfbh5^\x13qKD7yU(*-\x0e\xdb<\xd3\xda\x83\xbd\xe7L\xd3\xf8,\xebfWf\x90\xeb\xf4\r\xe7<I\xfa\x19\xc4\xb8\xb7\xd5\xd0\xd9\xffC\xd1\xbd\x05\xf1 j\xb0e\xbeB\x7f\xea6\xd9\xd3\x9d\t\xbd\x12\x86\xb4\x06\xd2R#\xd9\x02\xb4\xdc\xd8\x19\xe0\xca\xf5D\xd4\x02n\x1e\xb8\x83\x1c\xa3\xee\x04_ G\xc1\xa8m5#\xe5\xc3K^\xfc\x18%\x1a\xd4t\xa3\xd9\xcd\x18"\xce\xbb\x1f!H\ry/)\xf6\xe7Y8\x94\xe8Q\x9e\xc1\x18\x14\x83\rM\\\xd7%\xaa>\xc2P\x0f\x8e\x90\xe1}\xde{\x1e\xf3\xdbI\xcd\rE\xed\xc0\x95\xea\xb5\x98\xc8 /+i\xae\x0f\x93j\xe8\x8f-\xbf\x9d<\xa1\xc9\xbd\xc5\xc8evl\xc1B\x17[\xf4a\xa6\xbf\xf8\xe0\x87\xa9\xb7\xd7\x8dn\xee\x96\x97,\xa79t\x0f|\x9a\x89\xc5\xc6U\xc9\x85\x9f&\x9d\xb1\xbd\xc9\x87\xe3\xe5\x8bK\x17/]\xbdg\xbd \xbe\xc8\xe2_\x03\xc7\xb2\xd7%\xbfe\x11\xca\xa4\xd3Q\x806\xd0\x12\x1c\x17\x1f\xf0\x14\xc9\x93\r\x12i[\x91\xe7\xbf0\xd4U\x1e\xd8\xd0\t\xd1]%\xaa{\x16}1 =\x80?\xd4\x16=4\x82\xad\xdb\xb5\x9dq\xba\xb5v\xf9\x16\x99\xf1o\x1c-'
#11 Ether / IP / TCP 111.221.29.254:https > 192.168.0.2:65040 SA
#12 Ether / IP / TCP 192.168.0.2:65040 > 111.221.29.254:https A
#13 Ether / IP / TCP 192.168.0.2:65040 > 111.221.29.254:https PA / Raw / Data : b'\x16\x03\x01\x00\xc4\x01\x00\x00\xc0\x03\x03Q\xe5jM"Q\xbavC8\x16?\x15\x96e\xbb4\x80 \x0b\x0e\xe6\x1cQz\xc0Ns=O\xdd\xc8 8\x11\x00\x00\r q\x7f\xe6g\xc4\x1c\xa6\x1e\xdf\xf5\x16\xee\xd6%\xad\x0bL\x1f\x132\xc4\xc7\xdb0\xb9\xb8\x00\x1e\xc0/\xc0+\xc00\xc0,\xcc\xa9\xcc\xa8\xc0\t\xc0\x13\xc0\n\xc0\x14\x00\x9c\x00\x9d\x00/\x005\x00\n\x01\x00\x00Y\xff\x01\x00\x01\x00\x00\x00\x00\x1e\x00\x1c\x00\x00\x19vortex.data.microsoft.com\x00\x17\x00\x00\x00#\x00\x00\x00\r\x00\x14\x00\x12\x04\x03\x08\x04\x04\x01\x05\x03\x08\x05\x05\x01\x08\x06\x06\x01\x02\x01\x00\x0b\x00\x02\x01\x00\x00\n\x00\x08\x00\x06\x00\x1d\x00\x17\x00\x18'
#14 Ether / IP / TCP 162.125.80.3:https > 192.168.0.2:65024 A
#15 Ether / IP / TCP 111.221.29.254:https > 192.168.0.2:65040 A / Raw / Data : b'\x16\x03\x03\x0e1\x02\x00\x00Q\x03\x03]\\\xfcy\xc3\xa1P\xcc\x1e\xef63\x1b\rA\x13\xbb\xf4\xebN\xdaH\x92F\xc8gm\x87.\xee`6 \xab1\x00\x00\x95\xfc $\x19\x96g\x9e\xfe\xcfV~\x93\x9a\x16 \xa5\xe3\xe5\xb3\x1a6\xd0\xbb\xa7R\x86\xa9\xc0/\x00\x00\t\x00\x17\x00\x00\xff\x01\x00\x01\x00\x0b\x00\x0c\xa8\x00\x0c\xa5\x00\x06\xe70\x82\x06\xe30\x82\x04\xcb\xa0\x03\x02\x01\x02\x02\x13-\x00\x01\xf3T"\xb30~\xec\x95\x02\xb5\x00\x00\x00\x01\xf3T0\r\x06\t*\x86H\x86\xf7\r\x01\x01\x0b\x05\x000\x81\x8b1\x0b0\t\x06\x03U\x04\x06\x13\x02US1\x130\x11\x06\x03U\x04\x08\x13\nWashington1\x100\x0e\x06\x03U\x04\x07\x13\x07Redmond1\x1e0\x1c\x06\x03U\x04\n\x13\x15Microsoft Corporation1\x150\x13\x06\x03U\x04\x0b\x13\x0cMicrosoft IT1\x1e0\x1c\x06\x03U\x04\x03\x13\x15Microsoft IT TLS CA 50\x1e\x17\r180130155441Z\x17\r200130155441Z0&1$0"\x06\x03U\x04\x03\x0c\x1b*.vortex.data.microsoft.com0\x82\x01"0\r\x06\t*\x86H\x86\xf7\r\x01\x01\x01\x05\x00\x03\x82\x01\x0f\x000\x82\x01\n\x02\x82\x01\x01\x00\xe1\xcf\xafShk\xfaQ\x92\x8e\xc0ig\x9fpo\x0cDm\xfd\xf6\x10\xe1f\xf8iG\xe4\n \xe9E\x1f\xe0\x87\x15\xe4\x99\x92\x1fP\xb4\xae\xfc\xfd\xbc\x05kr\xf4\xe2?*\xb3\xe1\x9d\xf6\xd4oof^M5\x1c\x10\x830\xba\xfe8\xab_h~\x98\x7f{\x1c\\\xf1\xd0\xb4^\xbd\xcb\x8d,?\xbek\x80(J\xb9s|\x0f\x10\x9b\xd5\xa7\xde\xbe\x0ev\x11\x83\x9a\xb3\xd8\x02\xa9\xd9\x92\xcd\x0c`D\x7fU\xf3\x0c\xc6\x0fy\xd2\x0f\xd4S\xb2\xad\xde\'\xed\x0e\xb2\xb8B\xf7l\x1c\x0c*\xb5\xf9\x85\xc5\x02M\xf5\xcd\x15\xb9_\x9f\x96"<\xd0R\xe7"\xd6z\x04p\xf5\x12:\xfcf\x1f\xcc\xc2,n\x7fv\xa6\x83\xba\x8f\x02\xde\x80\xd4\xb8\xfb\x1a\xa5^)1\xe0xy\x85\x11M\xc4!\xd4\x1fl#c\x18Q\x01\x174\xffW\x18\x8c?\xed\x18{\x05\xcbx\xd56\x13\x11\x94\xde\xa2\x9c7@Z\xa9\n\xe7\xc0\x0e\x9fE\xd0i\x9c\x0b\x9c@\xca"T\xcd:\xa7\xfe\xd7\x11\x02\x03\x01\x00\x01\xa3\x82\x02\xa20\x82\x02\x9e0\x1d\x06\x03U\x1d\x0e\x04\x16\x04\x14Q\xd2\xfa\x7f\xa5k\xc4\x00\xe6\xcc\xf8:-\xad\x85:\xf8\xca\x0f~0\x0b\x06\x03U\x1d\x0f\x04\x04\x03\x02\x04\xb00\x1f\x06\x03U\x1d#\x04\x180\x16\x80\x14\x08\xfe%\x9ft\xea\x87\x04\xc2\xbc\xbb\x8e\xa88_3\xc6\xd1le0\x81\xac\x06\x03U\x1d\x1f\x04\x81\xa40\x81\xa10\x81\x9e\xa0\x81\x9b\xa0\x81\x98\x86Khttp://mscrl.microsoft.com/pki/mscorp/crl/Microsoft%20IT%20TLS%20CA%205.crl\x86Ihttp://crl.microsoft.com/pki/mscorp/crl/Microsoft%20IT%20TLS%20CA%205.crl0\x81\x85\x06\x08+\x06\x01\x05\x05\x07\x01\x01\x04y0w0Q\x06\x08+\x06\x01\x05\x05\x070\x02\x86Ehttp://www.microsoft.com/pki/mscorp/Microsoft%20IT%20TLS%20CA%205.crt0"\x06\x08+\x06\x01\x05\x05\x070\x01\x86\x16http://ocsp.msocsp.com0>\x06\t+\x06\x01\x04\x01\x827\x15\x07\x0410/\x06\'+\x06\x01\x04\x01\x827\x15\x08\x87\xda\x86u\x83\xee\xd9\x01\x82\xc9\x85\x1b\x81\xb5\x9ea\x85\xf4\xeb`\x81]\x84\xd2\xdfB\x82\xe7\x93z\x02\x01d\x02\x01\x1b0\x1d\x06\x03U\x1d%\x04\x160\x14\x06\x08+\x06\x01\x05\x05\x07\x03\x02\x06\x08+\x06\x01\x05\x05\x07\x03\x010M\x06\x03U\x1d \x04F0D0B\x06\t+\x06\x01\x04\x01\x827*\x010503\x06\x08+\x06\x01\x05\x05\x07\x02\x01\x16\'http://www.microsoft.com/pki/mscorp/cps0\'\x06\t+\x06\x01\x04\x01\x827\x15\n\x04\x1a0\x180\n\x06\x08+\x06\x01\x05\x05\x07\x03\x020\n\x06\x08+\x06\x01\x05\x05\x07\x03\x010A\x06\x03U\x1d\x11\x04:08\x82\x1b*.vortex.data.microsoft.com\x82\x19vortex.data.microsoft.com0\r\x06\t*\x86H\x86\xf7\r\x01\x01\x0b\x05\x00\x03\x82\x02\x01\x00\x90cOM\x1b\xe1#\x94M\xf9\x9e\xa5\x1d/+\xf3\xe5\xcaI\xc3\xbf\x80\xc6[.\xe3\x0c\xd53V\xaf.\xb0\xcbF\xa8\xbc\x80\xfc\x11_\x97\x9d9\xa9\xb1\xe8\x82Y\xe9\xba\x04\xf7jE\xac\xc5\xfb5a\x01Tx\x9f\xb8p\x83\xe6Ov\x98\x13\x87\x8f\xef\x17\xd2\xdcf\xc0g\x10\xc5_\xe06\x1e\xf7\xa9i8\xcfm\xb0\n\xcc\x80 \x90J\xbcL\xccE\x90'
#16 Ether / IP / TCP 111.221.29.254:https > 192.168.0.2:65040 A / Raw / Data : b'\xa9\xb7\xceGe\xff\xda\x82\xea\r\x8f\xd5t\xde\x00\x1c\xac\xf8\xfd\xcd\x0f\xa7\xd7t\xc76Q\\\x8d\xdfp\x1f6\x11\xa0P\xda6]\xb2\xacNF:\x99 \x95/\x1e \x94B\x0bH\xb3\x98\xce\x1b\x98\x90u#y\x95)\x11x;\x02Pm\xf8\xe0"j\x8cg\xaa\xdf\xe5.\x8a\x88R\xfc\x05](\xd8\xa5\xf3x\xaf\x1c\x10-\x13\xc10\xc1\xd5\x13,:*\xc3$\xcaUU\t\'\xe3\xe5\x06HP\xb4\xf6E\x1c *\x1ahR\xfb\xdd#2l\xe9\xc3\x12\x04\x08\x87\xd5\xff}\x01\x1f\xbf{\x98Nt~(\xf8\xf9\xd4\x99\x91X\xbc\xb9\x9f\x93\xe6\xe6\x11^\xad\xe1\xa7b\x08\xdd\xd3w\x9fS\xd1\x05\xe2\xdc\x85w\x04w\xb5\x97\xae\xe5\x00\xe8;\xb9\'\xa3\x0b\xd4\x81\xd3\x8d\xa6\xc2\xaf\xa0\x18\x03\xe5\xb7\xb4\x83(\x98 \x12C\x9aD\x8d\x8b\x0eX\xa7\xa4\xc9t\x8e\xa1>"U\xda\xcb\xd4\xccF\x16D\xde\x8d\xec\xda\x0e\x12\x19rq\xa9\x93\x8f:\xbei\x08C\x1f\xcb\x00!\xa5\x17;=\x06g}\'\x8atCb\xe0J\xe1n\x10\xbc\x19@\x8b\xc1O\x8am\xf7u\x95\xd4H\xd5\xcd\x13\xd2\xec\x809\xf5!\xedQku\r?}\xd8\xfd\xacy\xa5\xff@\xac}\x1c?K?\xde\x1c\x8d\x01\x85\xbe\xa2\xc4\x13\xaa\x93\x00Xmk]\xdd*\xb9P\x02\x9b\xd0&\xb9I7\xf3\xf1?\xcb1\x1a5\x1e\x02\xa1Y\x19\x19O\x8b|\xaf\x89\x0cF\x97jn\xf5\xed.l\xe3t&U\x1f!\x01x\xf5\xd2.]\xad7$%;\xe1-\x96@\\\x0b\x7f\'\xa9\xfb\xe3\xc2\xb0\xbd^\xb8=\xe2\x1e\xb4;\xdb}\x00\x05\xb80\x82\x05\xb40\x82\x04\x9c\xa0\x03\x02\x01\x02\x02\x10\x08\x88\xcdR_\x19$DM\x14\xa5\x82\x91\xde\xb9R0\r\x06\t*\x86H\x86\xf7\r\x01\x01\x0b\x05\x000Z1\x0b0\t\x06\x03U\x04\x06\x13\x02IE1\x120\x10\x06\x03U\x04\n\x13\tBaltimore1\x130\x11\x06\x03U\x04\x0b\x13\nCyberTrust1"0 \x06\x03U\x04\x03\x13\x19Baltimore CyberTrust Root0\x1e\x17\r160520125303Z\x17\r240520125303Z0\x81\x8b1\x0b0\t\x06\x03U\x04\x06\x13\x02US1\x130\x11\x06\x03U\x04\x08\x13\nWashington1\x100\x0e\x06\x03U\x04\x07\x13\x07Redmond1\x1e0\x1c\x06\x03U\x04\n\x13\x15Microsoft Corporation1\x150\x13\x06\x03U\x04\x0b\x13\x0cMicrosoft IT1\x1e0\x1c\x06\x03U\x04\x03\x13\x15Microsoft IT TLS CA 50\x82\x02"0\r\x06\t*\x86H\x86\xf7\r\x01\x01\x01\x05\x00\x03\x82\x02\x0f\x000\x82\x02\n\x02\x82\x02\x01\x00\x9a\xdf\x81\\;\x8f\xae\xe9y\x96\xb9\x9ay\xa7\x81\xf29\xdaU(F#\x02\xc5\x82f\x07\xb6\x15\xde\xfd\x9c:\x1a\x9b\x91\t\xd2f\x8f\x0b\x89\x17\xf8q\x87!\x7f8\xd3?\x9a%\x00\xb75\xd0\xab\xf8\x08z6\xf3P[\xdf+)\'\xde\xa4\xdd$\x92\xfa\xf4\xc6p\x8d6*\x9a\xf0\x80\xde5\xfa\x1eB\x9d\t\x81\xaa\xd5\x07\n\x16\xa5\xc5ZBmB\xbe\x1eB\x82\xb4W0\x99[E+\xd4\x8f\xd3\n\x06\xc6s\x93\xa4\xe1\x83\xef\xc5\xbf\x05\'\xa7x\xcd\xb3\x0b\xe0\x9e"\x16\xf3\x98\xdc\xa6\x14\xe8\xcc\x94\xd7#\xf9\xd0P\x99\xbb\xb5\x0b\x10\x95\xf1\xdf\x02\xe9\x8f\x8e\x9dV\x99<\xd8\x8f\xd3X\xfb\\\x92~={\xf8PIZ\xf7\x10{w\xf8\xe6J\x90JUR\xde\x94\xadt\t\xa0dW,\xcd\x07\x90\x9f\x16\xad\x95\xc3\xd1\x06\xba\xf1\xefl\x05\xb5\x04\xac\xa9\xdc\x1b1\x9b\x0e-\x19\x95\x04O\xdef\xcb\xad5r\xaf\x19\x82\x08\xb2\x14:\x16_\xb0<\x9b\xdb\x8d\x0c\xb0\x02\xd6&\x1f\xe8\x15q\xc4\xef\xf9c9C\x8c\xe9\xc2\x92.\xa1\xc2\xa00%\x0e\x96\'_\x9e\xa3+\x82\xd6\x10\xbd<\x19\x1e\xa6\x87\xfeU!:\\A\xfc\x01\x98\xcc/\x92\xfff8\xb4\xb8f\x9c\x0f\x12hKJ\xac\x86\xbb^\x98\xff\x9e\xa6\x9cSl3\x11\xa4\xd0\xaeRG\xd7\x8b\x8f\xf1\x96\xac\xb9)\x9a\x8f,\xf1\xadd\x18\xc3&\xbb\x00d\xdePp\xc0\xbb\xec\xc6k\xae\xd3\xa0\xef\xc0\xf1\\\r\xf2\xcczY\xda\x183/Y\x10\xadg\x14,_"CJD\xe1\xe8\xdd\xe0\xe7U\x16N\t\xef\x03L\x0cHPZ\xf0\x03\xdf\x8e\xefc\xca[g\x87C@,\x06\xb6\x1f\x0f>S\xc0f?\xd7\x14\x15\xe6\x08b\x98H~\x83\xe5\xa7\xb5]Q-T-a\xfd4]\xd4\xb7\x80\xcd\xd2}\xce\xb1$;\xf3\x97ll\x13\xde\x8a\x17\xc9\x8a\xf5H\x95B\xf7\x12\x90\xe3\x10\x17\xf6\xa1\x00\xc56*e\x91\x9e\x05\xecB.Z\xb8\x99\x1b\xff\xd4N\xb5\xfafU\xd9\x83\x8e\xbf\x08)\x8d\xfa\x0b\x02\x03\x01\x00\x01\xa3\x82\x01B0\x82\x01>0\x1d\x06\x03U\x1d\x0e\x04\x16\x04\x14\x08\xfe%\x9ft\xea\x87\x04\xc2\xbc\xbb\x8e\xa88_3\xc6\xd1le0\x1f\x06\x03U\x1d#\x04\x180\x16\x80\x14\xe5\x9dY0\x82GX\xcc\xac\xfa\x08T6\x86{:\xb5\x04M\xf00\x12\x06\x03U\x1d\x13\x01\x01\xff\x04\x080\x06\x01\x01\xff\x02\x01\x000\x0e\x06\x03U\x1d\x0f\x01\x01\xff\x04\x04\x03\x02\x01\x860\'\x06\x03U\x1d%\x04 0\x1e\x06\x08+\x06\x01\x05\x05\x07\x03\x01\x06\x08+\x06\x01\x05\x05\x07\x03\x02\x06\x08+\x06\x01\x05\x05\x07\x03\t04\x06\x08+\x06\x01\x05\x05\x07\x01\x01\x04(0&0$\x06\x08+\x06\x01\x05\x05\x070\x01\x86\x18http://oc'
#17 Ether / IP / TCP 111.221.29.254:https > 192.168.0.2:65040 PA / Raw / Data : b'sp.digicert.com0:\x06\x03U\x1d\x1f\x043010/\xa0-\xa0+\x86)http://crl3.digicert.com/Omniroot2025.crl0=\x06\x03U\x1d \x0460402\x06\x04U\x1d \x000*0(\x06\x08+\x06\x01\x05\x05\x07\x02\x01\x16\x1chttps://www.digicert.com/CPS0\r\x06\t*\x86H\x86\xf7\r\x01\x01\x0b\x05\x00\x03\x82\x01\x01\x00>\xf2\xcf0\xa5z\xbf\x1ej\xdf9X\x18(<\xc3\x9d\xee\xe7\x81\xc5K\xfcg\xf6\xbf\x1fN7\xda\xde\xf0\xaf\xee\x8a\xf9\x03{`gt\xc7;\xda\xff+J\xeb\xfdTu\x13\x8b\xe5\xc2\x81\x12\xbaR\x12 \xba)\x8a:\xcdC$\xcc\xd5\x17\x05\xfe\x9c\x16?s\xe0mA\xc0v=\xf2\xabH\xc5Ybd\xbaDO\n\x18\x82?A\xea?\x18:X\xe7\xa00Wu\xf5\xd1j1\x14\xb6\x94\x99e\xda\xb6\xe8\x01\xde\xe4\xab\xfb\xb5\xf3\xe5\x19\n\x18_\xa4\x02W\xde\xb6\\&os\xfe.\t\xf5\x08C\xc4\x0f\xc7$\x7f\x9d(ge\xa1\xdc[\xf0:\xfd\xf8p\x85\xe7\xa5O$\xdeB?\x1dD;]\x85\x06\x85\x1d\x1e\x1c\xd4\xd9NQ\xe4\xfd\x1e\x11\x16\xcc\x9e\x00\xd9\x97\x1a\x97\xe3e\xc7\x865\x1bSv\xbe2\xd1,AIK\xa3>\x93\x0c[wW\x070<5\x8b\x8c\xd1i\xa2\'\xfaU\xe8\xab\x9d\x10\x1e\xd1\x17\xdf\xbal\x89\xd3\xc9[\xd7\x0b\x94\x88\xa9\xd8\xb4\x95\xd7\x8e\x0c\x00\x01(\x03\x00\x1d G%\t\n\xce,\xa0\x86\xfc_[\xa1aJ\xa1\xfbF\xb8R\'\x83\x12c\xb5\xef\xdd\x0co\xa7\xcb\xb8c\x02\x01\x01\x00\xd8\xd1Y\x88U:\x15\x0b:\x04\xe3a\xf8\x9d\\\xe4@Ci\xc2\x0e\xaa\xea\n\xf9\\\xaf\xaeP\x18Bz\x02\xce\xf8\xc5\xc4\xc0\xe5\xefA\xf7\x1f\xa7\xbf\xb0\x15\xd2&\x8a\xca\xf3\x0fi-\xd0q\xd8\x8c\xb8\xdb\x9c\xa7%\xa0L\xab\x0e\x0e\xee9\xe9\xde;\xf3\x05%\x1b\xa6\xaeA!\xec\xfe\x15 N\x93t\xde>\x94aG\xb7<T\xa2\xb8W_\xb0q\xe3O\x10\x08]\xf6Q\xfb5X\xf5s\xde5B\xa7\xdd\xe8}\xa8.\xb6Hc\xf6,\x0c[0+!\x8e\x87A9\x83lG\x10<\xac\xe4\xc5\xb4\xe5\xc3\xd7\x0e\xf1\xcf\xa4\x95\x89\xa8\xe7\xd1\x17|p\xdc\xf4\x98\xa5\xb77\xcfe\xb5\x8f5^\x82\xb4\xe4^Y\xd5aVM\xe8^\xf2\xe2\xc8\xb8\xaej%m\xa4\x81K]=\x81\xa5zv\xd7\x9b"\xf1\xe6\r\x1d\xc8\x89\x7f\x03\xfb\x84\xb6\x98\x9f\xb5v\x881\x9fs\xa9\xadbtl\x86\x90+\xcf^\xcb\xb5\xc6\xcc\xc6\xbaYg\x98\xe7>\xb4l\xddt\xb2Y\xbd\xa2\xa8p\xd2\x0e\x00\x00\x00'
#18 Ether / IP / TCP 192.168.0.2:65040 > 111.221.29.254:https A
#19 Ether / IP / TCP 192.168.0.2:65040 > 111.221.29.254:https PA / Raw / Data : b'\x16\x03\x03\x00%\x10\x00\x00! \xa9\x1d\xf6\x03\xe2\xfd\xa6\xb0jp&\x02(J`"/\xf2\x8e)\x92T\xcf\x1e\xb5\xfc\x8a%\x1b\xe6\xac{\x14\x03\x03\x00\x01\x01\x16\x03\x03\x00(\x00\x00\x00\x00\x00\x00\x00\x00\xcc\tY\xdc\'\x01\x19\r\x93\xd1M0\xb9\xc5\x83\x94V\xe3;\\\x9e\xb91\xbb\xa9\x91\x16\xa0\xf2\xd6\x9fZ'
#20 Ether / IP / TCP 111.221.29.254:https > 192.168.0.2:65040 PA / Raw / Data : b'\x14\x03\x03\x00\x01\x01\x16\x03\x03\x00(\x00\x00\x00\x00\x00\x00\x00\x00\xc2\xca\xbc\x10\xab\xdb">\xb7\x95Ln\xe3-^KC\xe8\xb2\xd2\xb1\x00r\x00\xad:\x8d\xae=\xd2\xb05'
#21 Ether / IP / TCP 192.168.0.2:65040 > 111.221.29.254:https PA / Raw / Data : b'\x17\x03\x03\x00\xbf\x00\x00\x00\x00\x00\x00\x00\x01\xc4\xda\xd4)\xe2\xcd\\\xcd\x80R\x13\x96\xed\xbao\xaa^\xd1o\xc1\x0c\xcf\x83\x84j\xeaT\xaf\x8f\xf4\x8e\xb0M\xe4\xabE\x8b\xf3\xe7\xe4\x98\xda\xbf\xe4\xfc\x1e\xba\x83o\xab\xedX\x0c)\x02\xca?C\xe1z(C3|\xb2c\xc5\x7f\xdc\x14\x94d\x01\xc7\x14b\xd5\xa5\x16\x08\xf8\x98\xb4|\x95g\x88*\x96\xc1\xc6D\x82\xd3\x85n;yfQM\xa0\x8b\xfe5@:\xc7\xea\x04{\x10\xe6\x84\xab8\xfe\xb06 \x96)\x87"\xf5\xf4\xef\x12E/}\xe7\xc1\xc6\xb9\xfa\xe3oS3\xcd\xef\xaf\x8f\xf2\xd0\xa0\xdb\xdd\'\x14>\xd42\xc1\x7f\x13\xf9Qk\x9c\x15\xe2\'T\xde\xa4\xc1\xfe\xcbx7*\x12\xd8\xf8\xe7\xc6 \xa1\xc3Fg\x17\x03\x03\x03\x88\x00\x00\x00\x00\x00\x00\x00\x02\x11\xb2fr\xbaM\xe2\x12\x13\xd5\x97\xe6\xd2`\xca\xdb\xcf\x19^\xd6\x8a\x14\x96\xaf\x87N\x80\xa9^<T\x8b\xfeX\xdb\xc5\x9cs\xa8\xaf\xc4p\x1e\x00#\x08\xcd@\xb6\x98\xdfRB\xd1\xc1\xbe\xbc\xe3\xe5:E\x18\xecoO\xb0nJ\xcb\xa7\x96\xec\xfd\x97\xf9\x98\xd2tx\x95\xed.\x9b\x87\x03&l\x0c\x1cc\x83\xc4Y[\xe78\xcf\x03\x02\x1b\nJ\xe3\xe9\xa3%\x9eR)\xf52K\xde\xf7\x90-\xbd\xe8\xad\xe3\x92/\xe24\x1a\x10\xdb\x90]\x0c\xb8\xefGPUJ I\x14&\xfaq%\x86d$\x92\xeb\xac\xc0\xb2\xc1\x94\xd74\xde\xcc\xabj7\x84\xd7\x98\x84v\x08\x98\x0c\xf0\xc6Q\xa0\t\x8bE\xf0c\xa6\x89K\xbc6\xe3\xc9\x0eC|\xa9\x8e\x12\xf7\xb6\xbc\xe4\xd7q.\x11N\xc2\x9fiJ\x93\xffH\xf0Z\\\xbd\x1c\xd9\n\xb1\x9a\xc1i\xba\x8e0\x1d<9/\xab\xc3`s(U\xc8\x90R\xa3E\xa4k*n\x96\xc3\xde\x0cq\xbcz\xb9Q\xae\x92\x19>\xc0\xc7\x1eM\x07\xcd\xd21\xe3J\xd7\x14a\xf9\xb39\x8d\xc9Q\xeat6\x9ai\xa2F<\x12\xcd\xe5.\x1a\x03\xf2\xf3\xc5\xea\x0b\xb5\xf6\x8e\x97F2\xba\x12N\xc7o\x89\xbe\xe5\x82\xe1\xd7y\xd6QS\x99_\xa8\x03\x10\x9d\x1d\xd2\x87X;y6\xfdK\xa16a_\x0f&\x7fQM(\xc4,y\xdd\x95\xc3\x03\xe0\x8dC|\xfa\x17G_z\xcf\x1a\xf6\x91\xdd\xadp\xcf\x943u\x81;W:\x84\x94\xf18\xf2\xde\xc0\xc37\xe2&"\x18\xc9^cp!o(g\xceb\xd8)\x03Li\xceL?\xd1\xb8\xae\x81\xfd`r\xc6S\xc1iFxW\r#}\x8b\x18k$\xe1\x81\x04\xefP\x92\xd7\xb4\xed-\xc5\xe8\rT\xb0\xb8Q\x83m\x8d\xd7\xc2\xf1\n\x97\x17\xa1\xb1oLw  \x86\xcd\xea\xce?\x12z\xaegF@\x98a\x83"Q\xc62\x91\x80{2\x0b?\x15\xee\xfe\x06\x0b\xc9\x01\x0f~\xd4\xf5\xc1\xcd\xc3\x98\xbd\xe9}&\xbal\xb5hV\x07<\xed\x86\x00\x92~\x93(\xf2\x18\x9fd\xd5\xc0\xcf\xcc\x83\xd9\xc2\xff\x16d&\x1f\x7f\xf1\xbf\xfa\xea\xdb+\'~\xf0\xf1L[N\xb6\xcf\xfc\xdfC\x17`\xc8\xbc8\x8c\x95\xd6\xfb:^\xeb\x13\xb0\x98"\xa2\xa0\x8d\xf6\xf4\x96\x7f\xfb\x1bu"\xd0\xd5ov\xce.3_fS\xb7i\xaa\xe1z(\xa4\x15\x8e*\xb340\x01)G\xc4\xbfb\xb2w\x0c\xe4\xed\x96\xedd6\\e\xc5\xa60.P<\xe9\xe68\xd5\x04$\x91\xa8\x95\x7f\xea8uL\xf5\x85\xe5\x99\xb0\xf1\xd2\xbe\x08\xfc\x0b\xf9\x17_\x0f\xbd!\xe0\xa5;\xf7\xa8\x8d\xc2K\x99\x8f\xa74\xc7_m;\x82X\xe8\xad\xad\x9d\x9e\xd4V.\xc9i\xafi;\xc4\x8eY\xda\xf2[\x050.\x069^P\x91%\x0b\x7fH\xa6\xc8\x13\x80\x8b\x01\x18g\x8f\x87\xf2\x1a\'`"\xa4 1\x16z\x9a\xf1/\x19T\xa7\x14\xf9Y\x02\x8f(\xbbdEh\xbe:\x90\xd6&\xd4n9\xffl<\xb7\xa9\te^\xe4=\x00a\xf9\xb9\x08\xfe\xc5\n6uax\xd6\x87I\x97\xee\n\x8d\xea>i\x93m\xa2\x9c\xcf\x8a\xd8\t\xb7)?\t\xda\xa7 z\xe4\x1f\xef]{\xe8F\x0f\xe3\xa3\x8a2s#,\xbbf\xa1\xd7\x0b\xb7\xffK\xcc\xf7=\x96\x14D\x17\xa5\x9e!W\x0e\x8b@\xec5\x92{9@j\x07\xc5g\xae\xd7\xc6Z`K\xab\x99\n\x873\x90\x1a\x9a\xbc\x882\xf8d\xfeVa\xa1?)\x99NS\x12\xe9\xf9\xd0\xc3\x8e\xaes\xdd[\xa7\xcb\x91E_\xf3\x08\xb4\x1b\xf65]\x9e\x01,\x87\xda\xa0\x92\x1fa\xa9'
#22 Ether / IP / TCP 111.221.29.254:https > 192.168.0.2:65040 A
#23 Ether / IP / TCP 111.221.29.254:https > 192.168.0.2:65040 FPA / Raw / Data : b'\x17\x03\x03\x015\x00\x00\x00\x00\x00\x00\x00\x01\x8e\x9cw\x1c\xb3J\x91\xe2\xaf\xd9\x00\xf4lhu\xf2\xae\xe46\xe0\xa0\xaaU\xaf>\xc2P&p\xa5\\*\xcedYE\xd5;=u\xda\xda\xab\x8e\x88\xc3\x1c\x05^\xb7\xc8c\xb2<\x06,\xab\xe8\xebS\xb2\xe5\xb7\xd5\x88k\xa8\x93\xfb\xff^l\xf1E\x10\x11\x81\xae_d\xd8\xf0z6\xaa\xc3\xbdB\xc5\xc3\xbc?\xa5\xa2T\xb2n\x18p.\x95\x9a\xe2V\xb86\xb2 \\\xc4,!\xd9\xb4\xc0\xab\xf9\x0b\xb5\x8e\x8a\xf2\xb3\xd1GzFt\xb3\xc27m\xe3\xe5\\\x8e\xe1\nHn\x88\x89\xb6d>\xe2"P\xbc\xeeX\xa8\x87\xc6\xb6\x03\xd4\xdf\x0c\xb4J\xa1\xf2\xb9\xf3\x10&^E$&\x957+\x05\x8f=\x9f\xcf\xf6\xb7DVD\x8a\xe0G\xc6y\x04`\x9d&\x08\xcfp\x85\x11\xd0>\xdes\x11\xa5\xc3\xf5/\'\xb4\xcb\xba\x12\xc6\xe3\xc3\xe7\xd1\xfc\xa1\xd7X$z\xca\xaa\x1b\xba\\k\x0e\xa4\xfb\xbe\x1e\xdf\x9f\x7f$T\x07o\n\xd3;\xd1\xc7\xb2_\xd1\xa3\x83\x8e:H}\ti<\x83\x96\x8e\x17\xd9\x8e\xaf\x01|h\'4\xac%\xa6\xfc\xdfW\xc2\xe6\x87\xeee\xb4d\n6\xe9Na\xc6\xaa\xc9\xa1o\r\xd4\xc1\x17\xc3\x98Bg'
#24 Ether / IP / TCP 192.168.0.2:65040 > 111.221.29.254:https A
#25 Ether / IP / TCP 192.168.0.2:65040 > 111.221.29.254:https PA / Raw / Data : b'\x15\x03\x03\x00\x1a\x00\x00\x00\x00\x00\x00\x00\x03\xb6\xebg\xeeI\x16\xddhP\xbd\x03\x95\x04\xfa\xb0\xc8\x1a|'
#26 Ether / IP / TCP 192.168.0.2:65040 > 111.221.29.254:https FA
#27 Ether / IP / TCP 111.221.29.254:https > 192.168.0.2:65040 A
#28 Ether / IP / TCP 162.125.80.3:https > 192.168.0.2:65024 PA / Raw / Data : b'\x17\x03\x03\x02J\x00\x00\x00\x00\x00\x00\x00\x10B42\x1cvW\x85\xc7\x8b\x04\xddK\xb1\x9d\xff\xaf,)\xc8\xea\xce.\xf8\x1d!Q\xdbxeKf\xb0\x06\x82D\x18\x9c\x00\xdfA4\x0c\x7f\xee\xf6\x1b\x13\x08\xe8Jo\x17\xf8\xc3\xcaf\x18\xf3\xdf\x19\xd4\xa4\xbd\x8b\x98\x9bH\xb7d\xdb\xfd\x80D\x7f\xd1C(\xc5\x95\xf0\xbe?\x95B\xcf\x88\xd3%\xa3\xda\x90\xd5\xd2D\xea0\xca\xd8\x9c\xd4\xdd\x10\x04\xe5\x89qzo\xf0\x9c\x9e,P\xcd|\xe3\xcb\xf0@H./\x80`i\x1e\xe2o\xce\x8f\x92\xbd\xb8\xed\x1d\x90\xc8e].\xb5\x97\x05\xcd]=\xd9\x90\xb3\xdctr\xb4\xc4\x91\xb3?h\xf2\x9c\xed3\xe9\x9f\xc9\xe7w\x8c\x83\x02\xe3k9\x0f\x11\'C\x85/\x1bd\xb8\xa8\xb6l\xd1\x8c\xaa@\xbc\xbd\xb6Gz\x86\xaf$a:\x19\xea/eG\x85\xd2x\xadu\x82\xe1\xb2\x8c\x8aj\xc0\x12\x8e\x99\x13\xf5\xcf$x\x1f\x8cQo\xc3\xfa\xd2\x07\xf7q_\xbf\x92\x8bZH+\x97_\xa4b\x8ap\xfb\x1b[\xe9Our\xaa\xfb\x81ckH\xc1\rYxj\xca\x08\x8d/r\x19\xa1\xbc~e\x85\xf0\xea\x89\xb1\xaa\xa6\x1b\x08\xfeS\x88\xcd\xa9\xaa\\\x1e?\xda&\x9fs1\xc4\x07\x9e)\x93s\xef\x9a\xcd\xe9\xeb\x97*\x10n\xcf\x98\x96q\xf1]\xd1\x8a\xb3\xfd\x92\xdar\x7f\x19\xd0\x82\xfd\x03\xc6l:\xdd\xa7\x85\x82\x04\x97\xa7\xb8\xa6\x1eMm\xf4\xf0\xee\xc5:\xe4\xc3\xd1\xb3\x9d\xa68\xa7m\x18\xe5\xb3\xfc#v\x1b\x0b\x8a_\x10\x82r\xb3\xa5\x7fz\xf2\r/\xa9\xd4C\xfc\xf4\xccQA\xd7\xed\xe5\x80\xd8\t\xe1\xb3/$\x19U\x1cYkZ}\xe6N#|\xfaw\x9d;\x85h\xe6\xc8\x05\x8db\x84\xe1 \\g[\xb7\x9a\x97Q\xc17a\xba\xd3\xed\x02^\xce/E\x90D\xff\xa2[\x94?C\xf1\xf2"\x8c\x1f+#\xbe\xfb\xe4\n1\x02Z\xf9\xb3\xc5DN\x87X\xea\t\xf6\x1e\x1f\xfe\x97G4\x16\xa6-\x80\xf8O\xdc#\x93\x1c\xe5m\x1fK\xe2ID\xa3\x1f\xf9(\xbe\xa1m\xbfvf\xe5el\xcaz\x16\xc6d\x93\x02\xc3\xc9Kyd\xfb\xd2\xdc\xdethQ F\xaf\xa3\xdf\xd7\xacd\xa6\xc8\x140\xf7\xcb\x0cw\xa1V\x8cCYu\xb4E\x88\xb4:\x0e\xd4$\x0f\xe3mS\x06R~\xb9>\xf9&\xb1%D(\xecI\xf1$'
#29 Ether / IP / TCP 192.168.0.2:65023 > 162.125.80.4:https PA / Raw / Data : b'\x17\x03\x03\x02d\x0e\xb6\x92\x130\x93\xe8t\xda\x7f\x9a($\xfd\xae\x94_ U\x8c\xfb$\xefg\x88\x11\x1bd\x1bO\xd2\xa6\xfd@\xb6}\xf1Tp\x88\x8a\x11\xc4\xe1\xdf\xcb\xecKlX\x04\x94\xd1\x82"\x9e\xee\xa5\xf3*/\xdb\xcf\xf8\x91\xc03T\xb7\xe9d\xc8\x1c\xf5\xe6\xccgt\x8e\xb2\xba\xa5\xe32\xa7\x84Z\x0c\xb5y|\xb4PH\x8f\x88\xee~B\x1c\x01\xaa\xb4\x01]\x8e0\x92\x05\x93\x9fd(\xde\x96\xe3M.\xe4\x80o\xb7\xc1\x07]\xb3\x8e\xadk\xb2p\x0f\x17R1\xba\x8e[\xf0$\xc0d\xc5\xa7Wm\xe4\r8\xae\xe9\xf8\x0f<\xe3lD\xd7\xb7\x17,7-Y\xae\xed\xfaW\x7fE\xe4\xb0\xad_xIr\xa6D\x7f\xcf\x0b\xf22\xc4x\xc4A\x83`\xfc\xab\xcap\x05\xf6\xbe!\xc9\xba\x1f\x86\xf9U\x19:\xb2\x80\r:\x8f\xb8\x1f\xd5Ri\xa8\xb9\xdf%y<\x1eA\x87\xf9K\xcc\x9b\x8b L\x0f\xbb\x9a\xd3;\xa3\x91\x16\xf8\x04\x9a\xabE\xba\xff^\x10\x8d\xf6\x0e(\x08\x06#{4r\xeahu\x89"\xe7\x0e\xa5\x8e\xcfK\x00\xc5w\xbac\x1d\x98\xf0R\x9f\x06\xa9\xb9\x0c\xb3\x03\x8bw\xa7\xd73l\x86;\xaa\xbej\x1du\x1f\xb9\xeb\x0f4\xd4\x8e\x97\x0e\x05\r\x15cN\xaf\xc0i7v\xcf\x8f\xb4\x91\xe1{j\xf5\x81\xd8t\x1am\xb5g\xd0cg~\xdc\xcd\x8e\xb8\xa9\x0c\xa6\xaa\xd6\x86\xb41-\x04\x17\xeb\xba\x8f\x81\x8b\x12\xc5x\x07\r\x9a\x02oX0:\xfb\x98\xba\x85G\xa6\xaf \xd3\xc0L\x0ce1\xb7=\x8d\x1e\x8cN3\x9b\xb9\xec\x13\xa1\xd7\x1b\x8d\x94l\x91\xf5\x13U\xd3\xae\xa3\xc6T;+\xca\xe7\x01\x83\x18\x96\xab1\x18f\xb9\x0fe.\x9e\xea\x07\x90s6\xc4\xc0s\x10\x8bO\xee\xe3\xc7\xa0\x17\x13V\xf1#\x9c\xff\xec\xb9\x9bb\x8e\x9b\xbe\x9drz\xe8J\x12\xb8\x96b\x10I\xdfv\xfdu\x1b\x15\xcc\x17p\x91\xed@\xbe\xbf\xcc  \x00\tl5\xa0L\to\xdb[af\xde\xfc@\x05\xb9\xe6\xec\xd8\xd8\x06\xe0\x1f\xd1\xe9\'\xac{\xa1{\xef@\x9e`(\xad\x8a\xce\xbax0u%L\xf4UZ}B\x8dK\x8a=\x85\'\x17\x81\x97\tS\xa5\x93\x8ad\x07\x9c\x11MpW]7f|/\xd3\x91(\x9a\xbf\xc7\xe9\xdc*\x81I\xa0\x94\xcc\x8b\n\x1a\x00g\xba\xce4\xea\xd5\xe6\x99\xc3\xd8\xf3Z\xf9\xb6\xad(`u%\xae\xf46\xc6Q\xe8\xb8,W\xb3c\xc0\xa7\x18\x9d/\xcb'
#30 Ether / IP / TCP 192.168.0.2:65023 > 162.125.80.4:https A / Raw / Data : b'\x17\x03\x03\x05\xe1\x0e\xb6\x92\x130\x93\xe8u\xc7\xb7\xb8Ac%\xafQ\x9c\xce\x88I\xb7^S\xf3\xedM\xa0v\xcb\xd4W\x01\x9d\x1b\xc7\xdaI\x87/\xe4\x08\x01B\xd9\xc7\'V\xe5;\xd6&\xb0\xee\x19p1\xaf\xe2\xc7t\x83P@\n\xf8\x1f\x1di\x07\x87\xb1D\xc9&P\x95e\xb8\xc0\\\xdaM\xe1i\x06`\xc7\xea\xec\xbe\xb8S\xed\x14\xc9\xff\x87\x86K^4$7\x13\xd5\xc4 \xea\xce\r\x8b\xf3\x1fs\x8c\xbc\xb50w\njd\x95\xabG\xad\xb4Y\xcfO\x95\x93\xd3%D\x1e1\xae\xabs\xfd\xaa\xe2\x0b1\xf9]=\xc3\xcc\xd0\x8d3U\x9a\x0b\xde\x1d\xfd\xf1%\x15 ko\x8f\xe0\x15E\xb7\xfd\xfc1\xbc\xc1C)\xe9\x1d7\xc6\xef\xc7\x8726a\x9d\x98\xf2\xca\x05\x8b \x0bT\x0c\x10`\x97\x13\xa5\xa8\x839\x0e\xbbPa>/)\xa0\x99j\x02E\x16U%#\xbb\xf4\xcc\x8f\x835I\xc5\xf7\xb5\x11\x1f\xf0n\xf5\xf60-\xbe\xf8\x18\xd6wE\xb1\x11rD\x91\x1e\xa5\xe9v\xef\xd0\xac\xe6\x1dy\x01\xef\x9bs8P\xfc\xfc+\x05i\x0bO\xaf\xa0\xbc\x1e\x84\xa4\xc6j\x1bse\x10\xf5\xf9r(\x1bU\x83\xa2M\xa7\xb5\x92\xd7Ao<\x90\xdcF^\x9e\x16\x17\xb9j^\xadxUw\xe9\xb9ePk\x90:\xfd\xeft^.\xcf\xffO3\x11\xfb\x89\'\x83\xc2\x8bC\xacp#\x87O\xacM,\xa0\x83\xc8\xe7\x81\x88B^\x8a\xe3\xf7nR\x11\xb0\xe3kn\xe1b\xef\x89\x00\xe5\xf2\x90\xed\x05R\xd5\xd4\xf2\x0e\xf22\xb6\x1e\x0e\xa3\xccd\x98S\xa0s\xef\x06\x9bu\x872|K\x98"Gz\xa3\x80\x99\xb1\xc9\xcc`\xd9\x8a\xe3b\xce\x12\xa5\xe1\xa5\x05\xc8\x8f\xb6\x94\xfa\x92q&\xb0&\x04\xcd\xba\x19\x8a\xbd\xea\xdc\xe4\xea\xddN\x84+\x18\xbasb:h\xae\x88ho\t5\xeb\xd4\'\x0cE>q\xb9\xc5\xac\x93\xd4\x9c\x13\xdb\x11\x06@<\x9b\xe5\x93%#sk\x9d\xf5g\xf7:\xc1\xec$6\xcdyaQ\xabf\xd0c\xe4T\xbf\x91\xb2r\xc8=\x88)\x8dV\xf0l{\x82\xeb\xb1\x15mf.\xd5a\xbf\xf4\x00\x00\xe5\x86\x1a\x88\x92\x1a\x8d\xdb\xb0l\x81\xec\xd0\xe0\x13\xd3(\\\xde\x06f\xf3\xc5\xb0\x92N\xbb\xea\xf7\x0bA\xbdpo\xb5\x14E\xb6\xb8\x06\x83O\xe3\xe3\x03<Q\xb3\x8dK\x98d\xcd\x1c\xde \xacV+\x84F\x9eM\x1a,p\x0b(\xd9\xd4\xac\x84\x9fi\x05\xb3\x9eOW\x9f\n\xdb\xc0\xa0\x8bK*\xf9)\xfc\xd5\x14-\xa2:\xf6\xc9S\r\x1a\xf4\xf9lYyF\xd7\xd1\xde\xd8r\xfa\x16)\xf2\xc0\xfb\xb9\\$\x11\x08~\x05c\xe4\xec\xee\x13J\xd2\xb2C\xe3\x02\x99\x95\x89\x8a\x89X*]3\xd5\xbbaXL\xc2\x9c\x18\xd2\xb3\xe0U:R\x85\xac\xd1S\xef\xce\x82 \x7f+\xa8\xf1\x89\r\xf9&\xd2\xf0\xc2a\x84\xef\x8a\xa7\xadD\xdd x\x97\t\x85\xd7{\xee\xd9\x9c`\xae\x96>l\xc6\x10\n\xea>\xe5\xcau\xb4\x0b!\x88V>\xac\xf2\xc4Nb\xb5\x8f-\xb1\x8c6y^w\xd5\xe4\xc0\x97}\xe8\xcd\x04\xd3g>\xe5\xcczP\xea\xe4-2\x05`\xf8\x1a\x18\xd8<\x1a\'R\xf0\xfcx\xfb\r\xfeW\xcd=\x05\xd2V\xcbf -T\x03\xe7k\xa4\x9c)r\x0fn\xfe\xdc\xb6\xab=n+[\x16\x82\x9b\x0f?\xc8g\xccd\xc2\xe59kU\xa4{Z\xca\xc4\xd7\xe8\xbb\xf8-P\xd6{+4\x1e\xbb \xae\xf2\x01\xc4\x0bt\xbc\xafA(\xfe\xc6\x07\x1aE\xa9\x92D\x06e\x16\x98\xbfL\xb2\x86\x96+Z\x8e2\xf8\x89\x13\xd4\x1e\xc6yE\x06H:\x87Z\x93a6\xe5\xf0\xe6\xe4Du3\x0e\xc6\xd1\xbf37\xafL\x95d\xb1\xa1\xf0\xda\xb8\x8f\xcdJ\xeb\xe8\xc2\x8b`M\x9e\x0b\x8b\xf8\xd7.\xc2\x80\xffU\x8d\'(&(\xea\x96\xad\r\xab\x00X\x14\xe0qu\x07\xa6\xb3d\x82\x94\x88Q@\xf6pNK\xe3s\\\x1a#3\xcb~\x98~\x87\xbe\xd9\x1c\xb76\x03A\x83J\xce\x12\x18V8"\xa9Q\x808\xdf\xe3O^\x88i\x9dH\xb6\xeen\xfa\xe6\xe3\xb4%\x00\x94?*\xcc\xbe)\xc4\xc4\xf3\x90\xc6\x04\x8f\x9ek\xd5\xccaB\xe2\xa0\xabs\x00,\x92\xd8\x85h\xc0\x19+=Y\xcd\xbe\xdc\xf7\xfcj&\xfc\x1dB\x19\xfbcD\xba\xf2U\xfe-\xe0\x9d\x9f6\xca\xae\xc2]\xd36\xceV\xfc\xbc\x925y;|JG\xc3Y\x9c\x83\xc6\x97\x9c\xd7\xbc\xbd\xe3\xf1\xcc\xe8\xad\x93p\xa9D\x98U\x92\x90\x1a\xb8G\xe1Q\xd5\xf3\x1b@v\x9a\xb5\'W2\xeb\xe0\xf7B\x19\x81Kb\x82VQ\xe2\xa1\x9e\xbb\x08\xd1X\xd9\xf2\x80\x96\xe8"\x92f\xc2\x17\xbcb\xd9:\xaa\x06\xe4=\x1c\xfeb\xabI\x8cd9\x9e\xc0s\xd6h\xc62\xfb^\xe5\x0e!"\xa7\xc5\xbf\x11\x9az\xb2\xf7[r\xb6\x95\x9c\xe5\x9e\xef\x823/\xc7d\xd5CsbXO4\x85\xa1\x95=ovv\xd9I\x84#\xa7B\xfc\xb3F\xedg:\x96*C:`s&+\x8d\x00",eZ\xedep\x1b%\x07b(\xa7*\xce\xba\xa0\xdbq\xaaY\xf7\xa0\x03\xe6y\xc5H\xc5s\xb9lYw\xde%8\xf7\xd9\xab\xa2t\x04\xa6\xdc\xfb#\xe7X\xd9\x1d}o\x978\x866\xc6\xc8\xe3\x7f\xfb.V\xeb\xad\xf8\xd5s\xa4\x9dn\xeey\xda}&e\x80\xfaF\xc8\xbc&l:\x8bD\xe3\xe7E\x84J$\x88\xb3\x8e\xf3\xb73X\xaa\xfa:\xeb/\xf8\xa0\xd4\x96U\xe8\xc6g\x1cC\x86S\xe6\'?\x9bK}\x1c\xd4\xd3z,F8\xb4\xc1\xe77\x12\xa6\xc6\xc6Dvi\xde\x96\x1a\x8f\x10\xbe\x92\x94\xc7\x1d\xaaA\x9b\xcd5M\xa9\xfb\xac\x07T\x80\xe9\xd7\xc1\r\x89\xc9\xd9\x83\xf9\x1dU\xc3\xd8\x83\xdc\xfdAo\x16\xa6"d*\x0e\x12\xc1GXq{'
#31 Ether / IP / TCP 192.168.0.2:65023 > 162.125.80.4:https PA / Raw / Data : b";w\xbe\xed\xb9J\xf5\xe4(tVc7\n \xcd\x1eH\xd9*]\x1a\x15\xb9\xdfN\xd4D\xfb\x06,;xft\xba\x9a\xcd\xb9'\xa9_\x9c\n\xcd\xe1\xe3\x0c\xc6\x17\xd2\x8f\x80e]~\x7f\xa1MQQQ\xd9\xb8 C\x9c\xbe\xed\xda"
#32 Ether / IP / TCP 192.168.0.2:65024 > 162.125.80.3:https A
#33 Ether / IP / TCP 162.125.80.4:https > 192.168.0.2:65023 A
#34 Ether / IP / TCP 162.125.80.4:https > 192.168.0.2:65023 A
#35 Ether / IP / TCP 162.125.80.3:https > 192.168.0.2:65022 A
#36 Ether / IP / TCP 192.168.0.2:65022 > 162.125.80.3:https PA / Raw / Data : b'\x17\x03\x03\x02\xf3\x92\xa6\xea\xcbJ\xfb\x837\x8e\xb7\xc9 \x14\x9d\xd6\xbb\x8b\xb6\x85\x10\xeezv\x12\x07\xf4\xa8R\xa3\xa0\x07\xb7f8g\xc1\x97_\xe5t\xbe\xbd\xd5\xc3F\x17\xe0\xd7\x8d#c&\x00\xc3\x01\x80\xf4\x88dF\xb26\x91.\xd4\x8c\x98\x18q\x072]\x9e\xc6\xb3\xb5\xb8\x02\xdfy\xc8\xc3d\xc7#\xa10*6"\xac\xeaLpZ\xcacz?\xa6\xca#;\x1d\x85\x0b\x9au{\x13\xad\xd8(\xc3\xc3.\xc2\x00q,\xb3B\x001\xaf\x10w,\xe7W\x1eF{\xea\xab\xd2\x9c\x97G\x95\x7f\xb7\xaePm\x9d\xaa\x01\t\x99\xec\xe0l`\xfe/7\x0e\xaeU\xc3h\xe2Q\xfc@=\x1c\x02bPi\xb0\xb4\x08<\x03\xd4\x1a\xaa\x078\x90\xc2\xec\xa4\xc5\x84\x042R\xe5\x91\x1a\xdf*\xce\x8f\xb2\x1c@\xf6\xd4se\xfc\xaf\xef\xd9lr?Q\xd8\x01\xc1\xcf&\xa5c\xd6\x03Z\x88\xa1g\xefcTuQ\xc7\x94\x0b\xe9ZS0\x1d\x05jIjlB\xc6*\x1a\xc0\xaf$\xc6\xe2I[E\xa58u~\x92G/\n\x80^\xa0\xf1r\xc1\xba\x90\xe6h,^FU\xa3h4\xf1\xce\xd8\x80\xcd\xf9E\x0f9\xd1\x8c\xbb\x16\xbf\xb7gI\x1av$\xdc\xa8\xe2\t\x9b\xdc7kY\xe17\xdbT\xca\xc3U\xc9\x109\xdd\x15\xd1`\x0c[\xa8\xca\x9eb\xb5\x1b\xb3\x84\xa3\xf0\x88\x1c\x99$\xd9\xbbd\x11A>\xdb#\xdb\x9b\xc7]\xa4_\xe6*}\xb2\x7fp\x05x\xf1)\xaf*\xcf\xad\x97\xd9U\x8d\x97QE\x94\xd1L0`\t.\x93\xf6X\xc5\'\x9b\x9dj\x93\xdet\xb3f\xf5U|\xe8\x0c\xddh\xe0\x02\xa0\xb73X\x91\x9a\x1b\xa9QQ!\xd2\xa8\x8d6\x17\x00\xf5\xb8\xc0\t%\xc8\x8423N\x1b\xdf\x91PK%\xf6q\xbb\xcb\xf3\xd4q\xf1\xfd\xfe\x96\x0c\x84\x8e\xd2\xf6\x05\xdd\xb4\xa28\x83\xfa\x9e\x04y\xc7*\x0c\xca\x82\xef\xed\xe7\xacB\xa9P\xc4O\xfdC8I\xe4\xb0\xd5\xf34\x9d\xcd\xf9\xe3\xd2\t\xe6\x9a\xef\xda\xf8R\x86\x86 \xccq\x9c\xea\xb1\xfd|\xed\x17\xf87U\xc2\xd7\xdb\xf0\xfcu\x94\xca\xdf`\xc84\xda\xbd\xe1&\xa4\t\xf6\x1aJ7\xef\xf5o\x0cM@d\x9bD\xd4p\xa4\xe5Ptm\x93\x87\xd1\xa1\x17\xf4\xafb\x11\xf2\xd7Z\ny\x14\x05\xc9\xf4zqUJ\xfb\xbfN\x83\x89\x8f\x0eZw\xc4\x07\xd39\xac\xb4-\xd3\x1d2#\x88\x7f$f\x9cX\x06\xc6\xbc4A/\x01\xfb\t\x9a\xe9\x88\xa7\xf1\xa6V\xeb\xd6\xda|\xb9-L\x93\xb7d\xe4|\x95{\xf9\xe7\xd0\x9f\xba\x82\xe5\x9em\xf0w^\xb7\x83\x1a\x06@"\xa3 \x9fM\x1d\xa7\xed<p\t\xc1&\xe0E\x80\xa2\xe4\xc4#\xe1\xc4\xac-yC+h\xd8\x0e\xadsPd\x1fz\xaf\x0e\x89\xa1\x0cr\xef\xa5\xfe\x9e\xe4Q\xb5\x88\xca\xe3\xb8\x9d\xf3W\x7f-d)i\xb3\xae\xc3"}n*i2\xcc\xce\xb7\xf96E+7\x0e&\xf6\xd0r\x8a\x196\x0c\x97354\x16\x01\x97\x17\x80B\x05\xc8\xd8\xa8\xf6^b\x1f>F\x08o'
#37 Ether / IP / TCP 162.125.80.3:https > 192.168.0.2:65022 A
#38 Ether / IP / UDP 155.133.245.37:27017 > 192.168.0.2:49678 / Raw / Data : b'VS01\x00\x00\x07\x04\x02f\x03\x00\x02\x00\x00\x00\x00\x00\x00\x00\n\x05\x00\x00\x00\x00\x00\x00\x00\x00\x00\x00\x00\x00\x00\x00'
#39 Ether / IP / TCP 162.125.34.129:https > 192.168.0.2:65003 PA / Raw / Data : b'\x17\x03\x03\x02\r\x00\x00\x00\x00\x00\x00\x00\x0ch\x84\xd2\xd7\xb0ia\xce\x05^\xae\x19VO\xa6\xaeR\x85\xb5\xce\x8flmo,\xeeb\xda$7\x97\xfd~XtRb\xbfs\xda\xc1\xdcs{\xe6o8\x89_\x8e\xcf\xfa\xff\x98D\xb1\xb1\xb0\'W\x94\xfe\xe2\tw\xe4+y*\xae\xad\xc3\xca\xbf\x02q0\xccP\xb4\x98\x03>\xbeN@\xd4j,\x00#\xc2}\xfe\xedMO\xb7hg\xdbM\x81\x06\xea\xdb\xe2\x8f\xc6\x9ct\xdb\xf1\xb5J.y\x99\xc1\x9f}\x97\x00i>ScA\x87)\xf2\x91\x8f\xfd\xe2emA\xa5\xb0\xaciZ\xf7\x17,\xeb}\x8e\x04\xf0;\x16\xe8\x12\x18\xd1\t\xbfU$\x87Z\x88~9\xe2\xf1j\x13h!\xb2%\\\x18@\xa6\xabH"\xc7\x02HS\x88\xd8\x15\xc1\xfc\x81[+\x1c\xba1F6\x81Gyj%wu\xe4*<\xdf\x08\xae\xee(\xa4\xb8ymK\x7f\x1eA\x9a\xe4E\x16\x0c\xaf\x0f\xf4\xfe\x7f\x93\xa8\xc8\x05,~\x0b(/wD\x1f\xc6\xfd\xbd%@\xa10\xc8\x15\xe9\x1e\n\x16\x04\x80;\xdd\xaa\xbb$\x01\x9a\xe7\x07P\xedk]c\x8b\x1a=\x82\x86u\x0cB(\xe7\xb8\xfe\x16`rbC\xd3\xa7\xbe-\x9a\xfb\x93|A\xb5\xaa\xa8\x07G\xecC\xb0\xf2\xe5\x13t\x1b*\x8e\xd0\xbb\xf0\x8b\xe3<\xb2\xadw\xea\xc9N\xd3\x00\x9b{\x82\xcaQ\t\xa1\xc7O\x99\x87#Vp\x92.>P\xee\xe4-\x9e\n\x80\x9aZ\x8e\xee\xe5\x9c\x87\xba\xc2\x7ff\xd2\xe8\x88\x88I\xed\x07\xf0\xc4\xdd\xa89\xd8dd\x19\xd4\xb7k3\x0c\xab\x0c\xff\xa0j\x92\xe1=+\xee\xbb\xef\x18\x99N\x1eegXU#\xdd\x85\xe7\xf7q\xab\x94\x07\x8bDrL9\x14hko\xe9\xed$\x92\xe0\x18\x1e\xd7\x08\xc3\xd5\x9cj\xd5*Z\x97\xa7\xce\x90h\xce\x95\x81\xfd8?\xad0p\\\x98\x8e\xa9\xf1\x9b\xef\xd38}\xf2b~\xc3\xa9\xd0\x08!\xdf\xf3Pb\x15}tW6n\xb0,\x96\xd4$\xa4\t7&\xd2\xb2/\xefa\xea@r\xc3_\x14\x17u\xbb\x870\xdc\xc6\nm\x1f\x92\x89v\xcc\xeb\xef\r\x86'
#40 Ether / IP / TCP 162.125.80.3:https > 192.168.0.2:65022 PA / Raw / Data : b'\x17\x03\x03\x02`\x00\x00\x00\x00\x00\x00\x00\x13=\xf1p*\xc0\xbd\x93\x80\xb3LW\x06\xc8NL5\xef\xbe\x12h+\xfd\xb9\x9aQ\x81hmH\xa3\x85B\xa0\xe6S\xabX\x1e\xa4*[F\x9fO\xeb\xb0d\x9a\xd3\xba\x8acV\x95\xef\x12d#\xd1c\xba\x9b\xb7\xb8\x11c\x8f\\\xf2\x15\xa5\xa9\x9fDqC\xb5\xc7I\x8c|\xae]N\x83\x90\xe3\x0e A2\xe0\xd4\x11\xcd\x0f\xc9\xbd+H&\x99+\xd52\xdf\x8a\xb6N\xf8\xae\xef\x18\x95X\xbc\x9a\'\xc5]\\\x8e\x85\x16\x1c\x99Bs_\xd5}K\xc8z\x8a\xfd\x93:\xd7\x81\xfc\xf7H\x8e\x15\xaa\x96\xabf~<\x07\x02\xcft\x18?D\x03\xe7\r\x0b\xe7\xf4o.\xdb\xbaU{Fp\xe4$\xce\xbfU\xe2c\x9e\x0f\xa0\xba\xc8\xbb\r\xe6\x01.\xa0\xf7(\xa6k\xf0Z\xa4\xbel\xb1o\xa2\xeb\xab\x03\x0b\x9eH\xa6\x0bM\xef&,\x9e\xaa\x8a\xc0\xd1({\xd5(p\xf0\xf4\x92)\x8c\xcc;\x98:\xd0\x0bL\xe9\xfe\xb1-\xfe\xe2L\'\xb0\xfe\x17\x80\x8fz\xbd\x93\xa41ork\x98z\xe6\xe8\xa6\xd1\xbd\xfbp1\x99F\x85\xe56\x9f\x0el\x8eVB\xbd\\z\x8b\xfb\xd3\xc1=l\x88C\xce\xed\x06X\xefU\xaej\xe2\xe5\xef\xeb\x82\xba\xd2\xf3\xc7\x07]}Ho\x8a\xbd:*\xb6\xe22\xc1\x88\x83\xf0\x06\xfe\x83\t<m\xf7u\xdc#p*\xd5\xb2, \xc4\xdd\x18\x05w\xe0N\xcd\x84K\x87\x99\xb6|\x08\xcd\xfc\xff\x8fA\x9d\x88\xd2~\xc9\xe5\x82Y\xac\xfe\xdf\x90Fg\x0bs\xdd \x13\xac\xe7\x86\xa7A\x8fQ\x9b\xf7\x81\xcem]\xbf\xef;\x96U\xd9b\xe8\xe8\xf2>\xa7\xd7^zn\xd4X\xaabmsF\xa9\xf8\xf6\xde\xff\xd4TYj\x0b,x(f\xf9\xcc\x14D\xfd(\xfc\xb6\x08\x05\x1e\x0c\x837\x0b/\x0f\xf3\xa8\x1ac\x11\x81\xe8o\xe2\x1c\xa5y\xc1\xf0\xb3Q\xe7\xb6-\xb1\xfbBl\xf3\x8aa\xf7\xfco\xf1r\xa5\xee\xeb\xad\xa3\x92\x1bKO\xd4p&\xf4N\x97 ?a\xbe\\\xf6\x9dR\xbe=\x13J\xd1?b\xb5\xbb\x0f\n\xda]\xc3\xffm\x9c{\x1f\xd4\xa3\xb8(!{"JP\x9e\x9b\x80)\xc7:+L%\xb5RDgQ\xdfQ\xc5\xd8\xaa\xaf`\x99\x1e\x1a\\\x9c\x11\x8a\x13\xea\x9d[\xa0\x18E\xed\xb7"\x1d\xd0\xb69\xd1H\x8d\xf4\xba&\xa8\xf4\x1f}u\xdc\x1f^f\x95\xa9y#p\xc3i0~\xcb\x8a\xfd.\x9a[\xdaZ'
#41 Ether / IP / TCP 192.168.0.2:65003 > 162.125.34.129:https A
#42 Ether / IP / TCP 192.168.0.2:65022 > 162.125.80.3:https A
#43 Ether / IP / TCP 192.168.0.2:65024 > 162.125.80.3:https PA / Raw / Data : b'\x17\x03\x03\x02@x\xc2v\xa51Tq\r7\xf1\xe1\xb0(\x8d\xa3\xedj\xf7\xc8\x85[\x83\xf7cS\x8e\x04\xbeWN\xc7\x84\xe0\r`\x88\xc2Zwu\xd5\xd9\x00\x05^\x86\x97\x93gZ\xcf\xbf\xa6E\xd9M\xae\x81\xf1\xd4`D\x95\xe1\x9a\x9a\xc1d\xdcb\xfe\x7f-\xe0H\xff\xa7g9\x06\xbcn\x81\x11M<UZ\xc2\x06\x17\xfd\xa6\xc4\xc0@\xf6ROe\xaf\xd4\\;\x98\xd6\x8d4"\xfc\x97\x02\xc7\xc0\xe0\x1e\x8ac\xfc\xa7\xe9\xa3\x7f\x994{\xd81p\xd2.7\xf7\xbbo\xdf\x08.1$\x90+\xc4.G\xda\xe4.\x8c\x96M7\x9f\x91\xf9\tZ] \xcdR\xba\x0by\xdai\xea+\xaa\xc4\xbd\x91B\x0fW\x0fdV\xea\xfe\tz\x0e83Q\x1c\x03\x0f}\x04kB\xbfhv\x04\x95S\xd8\xfdw\xef\xee)\t\x8a\xa7\xaf\x10\x03\x08\x90\r\xfb\x05\xbch\x85\xc5@\x95w1\xed`\x89\n\xf8\xcb|\xed\xae\x0b\xc3"\xd7\x9f\x82\xcc\xf3\xe4\xc7&\xfc\x9dk\x00\x164%\x18\xb5\x0e\x04k\x90\xdcA\x03\xec\xf3\x8f\xcd\x13\xdc\x97\xce\'b\xe5^\xbab\xc5\xb4V\x1bs\xae\x1f\xec\x96\xd5\xc8V\xb7\xec\x91\xfb+\x824\x10\xa4\xd8\xaf\xe1o\xc3\xd76\x898r$S\xd7\x17\xee\x08tC\x94\xf6\xee\x9e"\xa8\xbfrk\x9d\xa9@\x16\\\xc1\xa6\xdb$eD\r7\xd3\x12\xf4>u\x15=\xdc\x9dtR\x14y\x0f\x04\xc1\x99\xc7\xa0\xed\xa8E\xeb\x14W\x9c\xf8\xb2\xb0I &\x1bg\x11\xd0\x80\x12\xa9\x97\xde@\xa7\xc1\xe4s\x9aQ\xb7\x1d\xaf\xd1\x16\xc6Q\x0c\xff\x8cL\xe6\xff\x15\x10\xa8\xee\xe1\xcc}\xc5Vu\xec\xbc\x89\x7f\x88\x1b\xd6\xcc\xf14\x87?bW\xb9\x1b\x9c<RUF9\x04\x1bM\xc1mKW\xf4\x01\xb4\xca\x9d\xb5\ru\x87\xb6\xcc\x8dt7\xe7\xfe\x85\xe7>\xd8X\xf8\xca\xce\xe5KZ\x7fz\xd5@\xaf\xa9s\xfb\xb2\xce"\xd2D\xe6Mv`\xafH\xf0\xa5\x95\x92.\xb3\xe1\xda\xd1\x94\x84t\xc1\x82\xe5\xb8/u\xce\xcc8\xd7\xeb\xe6\xba\xb1c\xf7\xcd\xb0\xae\x12\x91\x17\xd9Y\x0b\xb9\xb1U\xa0\xd6\x05=\xb8\xfd\x99)\x96\xc4\x0c\x82\x9c\x1f|\xfen\xe0\x87\x1cY\xcd\x92\x1b\xb2\xbc\xa6\xd1\x17\xd8C\xf5\xe0\xdbWQG\xcf\x1f\xc9\xfca\xa7\xca\xd5:\xf7\xf6\x0b\xa7\xd9\r\xd7\t\xa6'
